web_scraper_order,web_scraper_start_url,product_link,product_link-href,pagination,pagination-href,item_name,item_brand,item_price,item_description,item_id,item_materials
1762210615-56,https://www.rei.com/s/hiking-gear-clothes-boots,,https://www.rei.com/product/227953/rei-co-op-flash-22-pack,,,REI Co-op   Flash 22 Pack,REI Co-op,$59.95 ,"Lean, clean and well appointed, the REI Co-op Flash 22 pack is the perfect size for day hikes and done-in-a-day summits. It features a removable sit pad for enjoying those well-earned vistas.",#227953,70-denier recycled ripstop nylon with polyurethane coating (bluesign approved)
1762210618-57,https://www.rei.com/s/hiking-gear-clothes-boots,,https://www.rei.com/product/100521/whistles-for-life-tri-power-whistle,,,Whistles for LIFE   Tri-Power Whistle,Whistles for LIFE,$8.95 ,This Tri-Power Whistle is an essential piece of safety equipment to have on you during outdoor activities.,#100521,ABS plastic
1762210625-60,https://www.rei.com/s/hiking-gear-clothes-boots,,https://www.rei.com/product/132219/hart-outdoor-day-hike-first-aid-kit,,,HART Outdoor   Day Hike First-Aid Kit,HART Outdoor,$15.95 ,"Be prepared for the typical needs of 2 people on a short day trip with the compact HART Outdoor Day Hike first-aid kit. Clear compartments keep medical supplies organized, visible and easy to access.",#132219,Polyester/PEVA
1762210957-1,https://www.rei.com/s/hiking-gear-clothes-boots,,https://www.rei.com/product/C04663/timberland-greenstride-motion6-sneakers-mens,https://www.rei.com/s/hiking-gear-clothes-boots?page=104,,Timberland   GreenStride Motion6 Sneakers - Men's,Timberland,$96.73 ,Step into comfort with these Timberland sneakers. They're made with a blend of leather and ReBOTL™ fabric. And they have comfy midsoles made with renewable resources.,#C04663,Premium Timberland leather and ReBOTL fabric; ReBOTL fabric; Rubber
1762210960-2,https://www.rei.com/s/hiking-gear-clothes-boots,,https://www.rei.com/product/C03869/asolo-eldo-gv-approach-shoes-mens,https://www.rei.com/s/hiking-gear-clothes-boots?page=104,,Asolo   Eldo GV Approach Shoes - Men's,Asolo,$141.73 ,"Head to the mountains, the crag or your local park. These Asolo men's approach shoes provide protection and support on days when you'll be spending some time on your feet.",#C03869,Polyester; Molded EVA foam
1762210965-3,https://www.rei.com/s/hiking-gear-clothes-boots,,https://www.rei.com/product/C03746/keen-versacore-speed-shoes-womens,https://www.rei.com/s/hiking-gear-clothes-boots?page=104,,KEEN   Versacore Speed Shoes - Women's,Keen,$97.73 ,Need shoes that can do everything you want to do outside? Here they are. These KEEN all-around athletic hikers can easily go from an outside workout to a day on the trail.,#C03746,Performance mesh
1762210975-4,https://www.rei.com/s/hiking-gear-clothes-boots,,https://www.rei.com/product/229699/la-sportiva-tx4-evo-mid-gtx-approach-boots-womens,https://www.rei.com/s/hiking-gear-clothes-boots?page=104,,La Sportiva   TX4 EVO Mid GTX Approach Boots - Women's,La Sportiva,$239.00 ,"Whether the trail is the objective or just the first step to reach your climb, the women's waterproof La Sportiva TX4 EVO Mid GTX approach boots are built to navigate the technical terrain.",#229699,"Nubuck leather; cushioned tongue with recycled fabric; recycled rubber rand/toe cap; Mythos Lacing System with recycled laces/hooks; Fabric forefoot wrap; Traverse Injection MEMlex with co-molded TPU shank and 7% recycled EVA; ESS Resole platform; Vibram Megagrip rubber with Impact Brake System, Climbing Zone Platform and 3 mm lugs; Recycled air mesh heel; bluesign-certified ePE GORE-TEX Extended Comfort

"
1762210978-5,https://www.rei.com/s/hiking-gear-clothes-boots,,https://www.rei.com/product/237875/asolo-eldo-lth-gv-approach-shoes-mens,https://www.rei.com/s/hiking-gear-clothes-boots?page=104,,Asolo   Eldo LTH GV Approach Shoes - Men's,Asolo,$200.00 ,"Whether you're heading to the mountains, crag or your local park, the men's Asolo Eldo LTH GV approach shoes provide protection and support for days when you'll be spending some time on your feet.",#237875,Water-resistant suede; Molded EVA foam; Vibram MegaGrip rubber; GORE-TEX waterproof/breathable membrane
1762210983-6,https://www.rei.com/s/hiking-gear-clothes-boots,,https://www.rei.com/product/237631/asolo-eldo-mid-lth-gv-approach-boots-mens,https://www.rei.com/s/hiking-gear-clothes-boots?page=104,,Asolo   Eldo Mid LTH GV Approach Boots - Men's,Asolo,$210.00 ,"Ideal for technical approaches, day hikes or weekend overnights, the Asolo Eldo Mid LTH GV men's approach boots balance waterproof protection, lightweight comfort and all-terrain traction.",#237631,Water-resistant suede; Molded EVA foam; Vibram MegaGrip rubber; GORE-TEX waterproof/breathable membrane
1762210992-8,https://www.rei.com/s/hiking-gear-clothes-boots,,https://www.rei.com/product/246561/aku-rock-dfs-ii-gtx-approach-shoes-mens,https://www.rei.com/s/hiking-gear-clothes-boots?page=104,,AKU   Rock DFS II GTX Approach Shoes - Men's,Aku,$200.00 ,"Designed with the AKU-exclusive Dual Fit System, the men's AKU Rock DFS II GTX Approach Shoes deliver both maximum comfort during your approach and a high-performance fit while climbing or scrambling.",#246561,Leather/synthetic microfiber
1762211003-12,https://www.rei.com/s/hiking-gear-clothes-boots,,https://www.rei.com/product/C05268/the-north-face-hedgehog-3-mid-waterproof-boots-womens,https://www.rei.com/s/hiking-gear-clothes-boots?page=104,,The North Face   Hedgehog 3 Mid Waterproof Boots - Women's,The North Face,$108.73 ,"An update to a classic, these women's boots from The North Face offer more cushioning underfoot. They have a rugged design and a waterproof DryVent™ membrane, which make them perfect for hiking.",#C05268,Leather/synthetic leather/durable ripstop/spacer mesh; DryVent waterproof membrane; EVA
,,,,,,,,,,,
1762211010-14,https://www.rei.com/s/hiking-gear-clothes-boots,,https://www.rei.com/product/239259/la-sportiva-tx-guide-leather-approach-shoes-womens,https://www.rei.com/s/hiking-gear-clothes-boots?page=104,,La Sportiva   TX Guide Leather Approach Shoes - Women's,La Sportiva,$97.73 ,"Speed and comfort marry durability and stability in La Sportiva TX Guide Leather approach shoes for women. They can travel on nearly any terrain whether you're climbing, running, hiking or walking.",#239259,Nubuck/rough-out leather; heel and toe caps: polyurethane Tech-Lite
1762211013-15,https://www.rei.com/s/hiking-gear-clothes-boots,,https://www.rei.com/product/249771/arcteryx-konseal-approach-shoes-womens,https://www.rei.com/s/hiking-gear-clothes-boots?page=104,,Arc'teryx   Konseal Approach Shoes - Women's,Arc'teryx,$190.00 ,"Rugged trails or 4th-class climbing, these Arc'teryx approach shoes are up for it. The outsoles can smear up slabs and descend softer ground. Carbon-fiber midsole shanks add stability.",#249771,Nubuck leather; Compressed EVA
1762211016-16,https://www.rei.com/s/hiking-gear-clothes-boots,,https://www.rei.com/product/246018/scarpa-rapid-lt-approach-shoes-womens,https://www.rei.com/s/hiking-gear-clothes-boots?page=104,,Scarpa   Rapid LT Approach Shoes - Women's,Scarpa,$169.00 ,"Trail-ready and approach-capable, the Scarpa Rapid LT women's shoes combine the friction of Vibram® Megagrip soles withe the lightweight, breathable support of knit uppers with full-perimeter rands.",#246018,Polyester mesh; TPU overlays
1762211019-17,https://www.rei.com/s/hiking-gear-clothes-boots,,https://www.rei.com/product/229697/la-sportiva-tx4-evo-mid-gtx-approach-boots-mens,https://www.rei.com/s/hiking-gear-clothes-boots?page=104,,La Sportiva   TX4 EVO Mid GTX Approach Boots - Men's,La Sportiva,$239.00 ,"Whether the trail is the objective or just the first step to reach your climb, the men's La Sportiva TX4 EVO Mid GTX waterproof approach boots are built to navigate the technical terrain.",#229697,"Nubuck leather; cushioned tongue with recycled fabric; recycled rubber rand/toe cap; Mythos Lacing System with recycled laces/hooks; Fabric forefoot wrap; Traverse Injection MEMlex with co-molded TPU shank and 7% recycled EVA; ESS Resole platform; Vibram Megagrip rubber with Impact Brake System, Climbing Zone Platform and 3 mm lugs; Recycled air mesh heel; bluesign-certified ePE GORE-TEX Extended Comfort

"
1762211021-18,https://www.rei.com/s/hiking-gear-clothes-boots,,https://www.rei.com/product/165425/la-sportiva-tx-guide-approach-shoes-womens,https://www.rei.com/s/hiking-gear-clothes-boots?page=104,,La Sportiva   TX Guide Approach Shoes - Women's,La Sportiva,$199.00 ,"Built to move fast and light on vertical terrain, the women's La Sportiva TX Guide approach shoes draw inspiration from speedy trail runners and techy rock shoes for support, comfort and grip.",#165425,"Ultra-weave jacquard textile/thermoplastic polyurethane reinforcements

"
1762211030-21,https://www.rei.com/s/hiking-gear-clothes-boots,,https://www.rei.com/product/179279/keen-revel-iv-high-polar-boots-mens,https://www.rei.com/s/hiking-gear-clothes-boots?page=104,,KEEN   Revel IV High Polar Boots - Men's,Keen,$210.00 ,"Don't let wild weather keep you indoors. Your feet will love the warmth and waterproof protection of the men's KEEN Revel IV High Polar boots, rated to -40°F for comfort in extreme cold.",#179279,KEEN.DRY waterproof breathable membrane
1762211035-23,https://www.rei.com/s/hiking-gear-clothes-boots,,https://www.rei.com/product/C04667/timberland-motion-access-low-lace-up-sneakers-womens,https://www.rei.com/s/hiking-gear-clothes-boots?page=104,,Timberland   Motion Access Low Lace-Up Sneakers - Women's,Timberland,$89.73 ,Make your way from city to trail in these Timberland Motion Access sneakers. They feature a supportive TimberCush™ comfort system and TimberGrip™ lug outsoles. And they are made with recycled fabric.,#C04667,ReBOTL fabric
1762211046-27,https://www.rei.com/s/hiking-gear-clothes-boots,,https://www.rei.com/product/255394/salewa-wildfire-edge-approach-shoes-mens,https://www.rei.com/s/hiking-gear-clothes-boots?page=104,,Salewa   Wildfire Edge Approach Shoes - Men's,Salewa,$125.73 ,"Switch between hiking and climbing modes to tackle any terrain in these technical approach shoes from Salewa. They provide a precise yet flexible fit, good support and aggressive grip.",#255394,Exa Shell over-injected 3D cage; 1.6 mm suede leather
1762212279-31,https://www.rei.com/s/hiking-gear-clothes-boots,,https://www.rei.com/product/245849/la-sportiva-prodigio-hike-gtx-hiking-shoes-mens,https://www.rei.com/s/hiking-gear-clothes-boots?page=3,,La Sportiva   Prodigio Hike GTX Hiking Shoes - Men's,La Sportiva,$199.00 ,"Designed for hikers who want to move efficiently across rugged trails and mountain terrain, the men's La Sportiva Prodigio Hike GTX shoes are your ticket to exploring new trails.",#245849,bluesign-certified ePE GORE-TEX Extended Comfort membrane
1762212281-32,https://www.rei.com/s/hiking-gear-clothes-boots,,https://www.rei.com/product/209430/cotopaxi-subo-pants-mens,https://www.rei.com/s/hiking-gear-clothes-boots?page=3,,Cotopaxi   Subo Pants - Men's,Cotopaxi,$44.83 ,"Lightweight and movement-friendly, the Cotopaxi Subo men's pants are constructed from a sun-protective, water-resistant fabric to help you climb higher no matter your pursuit.",#209430,90% recycled nylon/10% spandex
1762212283-33,https://www.rei.com/s/hiking-gear-clothes-boots,,https://www.rei.com/product/239546/danner-panorama-waterproof-low-hiking-shoes-mens,https://www.rei.com/s/hiking-gear-clothes-boots?page=3,,Danner   Panorama Waterproof Low Hiking Shoes - Men's,Danner,$149.95 ,"You're packed up—now lace up the dependable Danner Panorama Waterproof Low hiking shoes and go. Designed to take you farther, these men's hiking shoes are comfortable and stable for trail adventures.",#239546,Danner Dry 2-layer waterproof/breathable laminate
1762212286-34,https://www.rei.com/s/hiking-gear-clothes-boots,,https://www.rei.com/product/805568/carolina-mfg-tie-dye-bandana,https://www.rei.com/s/hiking-gear-clothes-boots?page=3,,Carolina Mfg.   Tie Dye Bandana,Carolina Mfg.,$6.00 ,The Carolina Mfg. Tie Dye bandana features bright color combinations to add pizzazz to your hiking wardrobe.,#805568,Cotton
1762309328-1,https://www.rei.com/s/hiking-gear-clothes-boots?ir=collection%3Ahiking-gear-clothes-boots&r=category%3Amens-clothing&page=3,Outdoor ResearchInsect Shield Brim Hat,https://www.rei.com/product/794186/outdoor-research-insect-shield-brim-hat,,,Outdoor Research   Insect Shield Brim Hat,Outdoor Research,$26.83,Fend off insects and stay shaded from the sun with the Insect Shield Brim Hat from Outdoor Research. It's treated with Insect Shield® and provides UPF 40 protection.,#794186,60% recycled nylon/40% bluesign® approved nylon
1762309331-2,https://www.rei.com/s/hiking-gear-clothes-boots?ir=collection%3Ahiking-gear-clothes-boots&r=category%3Amens-clothing&page=3,REI Co-opStormhenge 850 Down Hybrid Jacket - Men's,https://www.rei.com/product/234790/rei-co-op-stormhenge-850-down-hybrid-jacket-mens,,,REI Co-op   Stormhenge 850 Down Hybrid Jacket - Men's,REI Co-op,$279.00,Wish your favorite puffy was waterproof? Wish granted. The men's REI Co-op Stormhenge 850 Down Hybrid jacket combines goose down and recycled insulation in a HydroWall™ waterproof/breathable shell.,#234790,"94% recycled ripstop nylon/3% nylon/3% polyester (bluesign approved); hood, shoulders, lower body, cuffs: recycled nylon with polyurethane coating (bluesign approved)"
1762309334-3,https://www.rei.com/s/hiking-gear-clothes-boots?ir=collection%3Ahiking-gear-clothes-boots&r=category%3Amens-clothing&page=3,VuoriMeta Pants Athletic Slim - Men's,https://www.rei.com/product/135816/vuori-meta-pants-athletic-slim-mens,,,Vuori   Meta Pants Athletic Slim - Men's,Vuori,$101.93,The men's Vuori Meta Athletic Slim pants let you get away with wearing super comfortable pants to work—then take them on adventures on your days off.,#135816,Polyester
1762309337-4,https://www.rei.com/s/hiking-gear-clothes-boots?ir=collection%3Ahiking-gear-clothes-boots&r=category%3Amens-clothing&page=3,CotopaxiTeca Fleece Headband,https://www.rei.com/product/211161/cotopaxi-teca-fleece-headband,,,Cotopaxi   Teca Fleece Headband,Cotopaxi,$20.00,"When the chilly weather rolls in, reach for the Cotopaxi Teca Fleece headband to keep your ears warm. This cozy and colorful headband is great for everything from autumn hikes to snow day outings.",#211161,Recycled polyester fleece
1762309340-5,https://www.rei.com/s/hiking-gear-clothes-boots?ir=collection%3Ahiking-gear-clothes-boots&r=category%3Amens-clothing&page=3,REI Co-opFlash Merino Wool Lightweight Quarter Socks,https://www.rei.com/product/210626/rei-co-op-flash-merino-wool-lightweight-quarter-socks,,,REI Co-op   Flash Merino Wool Lightweight Quarter Socks,REI Co-op,$17.95,"The REI Co-op Flash Merino Wool Lightweight quarter socks are our most popular summer-weight hiking socks for good reason—they're naturally breathable, sweat wicking, quick drying and odor resistant.",#210626,45% merino wool/44% nylon/8% polyester/3% spandex
1762309342-6,https://www.rei.com/s/hiking-gear-clothes-boots?ir=collection%3Ahiking-gear-clothes-boots&r=category%3Amens-clothing&page=3,Carolina Mfg.Tie Dye Bandana,https://www.rei.com/product/805568/carolina-mfg-tie-dye-bandana,,,Carolina Mfg.   Tie Dye Bandana,Carolina Mfg.,$6.00,The Carolina Mfg. Tie Dye bandana features bright color combinations to add pizzazz to your hiking wardrobe.,#805568,Cotton
1762309346-7,https://www.rei.com/s/hiking-gear-clothes-boots?ir=collection%3Ahiking-gear-clothes-boots&r=category%3Amens-clothing&page=3,FjallravenVidda Pro Ventilated Trousers - Men's,https://www.rei.com/product/229159/fjallraven-vidda-pro-ventilated-trousers-mens,,,Fjallraven   Vidda Pro Ventilated Trousers - Men's,Fjallraven,$180.00,"Beloved fan favorites, these Fjallraven Vidda Pro Ventilated trousers have been updated with improved ventilation and a slimmer fit that doesn't sacrifice the mobility your trekking ventures require.",#229159,G-1000: 65% recycled polyester/35% organic cotton
1762309350-8,https://www.rei.com/s/hiking-gear-clothes-boots?ir=collection%3Ahiking-gear-clothes-boots&r=category%3Amens-clothing&page=3,KUHLRenegade Rock Pants - Men's,https://www.rei.com/product/228202/kuhl-renegade-rock-pants-mens,,,KUHL   Renegade Rock Pants - Men's,KUHL,$99.00,"Designed with climbers in mind, the KUHL Renegade Rock pants feature a tapered fit and durable soft-shell fabric made for long days on the approach and at the crag.",#228202,95% nylon/5% spandex
1762309352-9,https://www.rei.com/s/hiking-gear-clothes-boots?ir=collection%3Ahiking-gear-clothes-boots&r=category%3Amens-clothing&page=3,CotopaxiSubo Pants - Men's,https://www.rei.com/product/209430/cotopaxi-subo-pants-mens,,,Cotopaxi   Subo Pants - Men's,Cotopaxi,$44.83,"Lightweight and movement-friendly, the Cotopaxi Subo men's pants are constructed from a sun-protective, water-resistant fabric to help you climb higher no matter your pursuit.",#209430,90% recycled nylon/10% spandex
1762309354-10,https://www.rei.com/s/hiking-gear-clothes-boots?ir=collection%3Ahiking-gear-clothes-boots&r=category%3Amens-clothing&page=3,REI Co-opRainier Rain Pants - Men's,https://www.rei.com/product/227731/rei-co-op-rainier-rain-pants-mens,,,REI Co-op   Rainier Rain Pants - Men's,REI Co-op,$99.95,"If you don't like the weather on the trail, wait 5 minutes. Or pull on the waterproof, breathable REI Co-op men's Rainier rain pants for protection for when the dark clouds don't pass.",#227731,100% recycled ripstop nylon (bluesign approved)
1762309357-11,https://www.rei.com/s/hiking-gear-clothes-boots?ir=collection%3Ahiking-gear-clothes-boots&r=category%3Amens-clothing&page=3,PatagoniaCapilene Cool Daily Shirt - Men's,https://www.rei.com/product/143349/patagonia-capilene-cool-daily-shirt-mens,,,Patagonia   Capilene Cool Daily Shirt - Men's,Patagonia,$45.00,"Work out and go out, all in the same clothing. The men's Patagonia Capilene Cool Daily shirt provides comfort for running, climbing or just hanging out with your friends.",#143349,Solids: recycled polyester jersey; heathers and cross-dyes: 50% polyester/50% recycled polyester jersey
1762309360-12,https://www.rei.com/s/hiking-gear-clothes-boots?ir=collection%3Ahiking-gear-clothes-boots&r=category%3Amens-clothing&page=3,Free CountryNylon Stretch Belted Pants - Men's,https://www.rei.com/product/245716/free-country-nylon-stretch-belted-pants-mens,,,Free Country   Nylon Stretch Belted Pants - Men's,Free Country,$59.73,"Whether your trek is on wooded trails or just down the block, these men's Free Country pants are ready for any activity, with plenty of pocket space for your on-the-go essentials.",#245716,94% nylon/6% spandex
1762309363-13,https://www.rei.com/s/hiking-gear-clothes-boots?ir=collection%3Ahiking-gear-clothes-boots&r=category%3Amens-clothing&page=3,REI Co-opActivator Pants - Men's,https://www.rei.com/product/234906/rei-co-op-activator-pants-mens,,,REI Co-op   Activator Pants - Men's,REI Co-op,$99.95,What's your perfect pair of trail pants? Wind-resistant and water-repellent? Breathable and stretchy? Plenty of secure pockets? That's the men's REI Co-op Activator soft-shell pants!,#234906,63% nylon/26% polyester/11% spandex (bluesign approved)
1762309365-14,https://www.rei.com/s/hiking-gear-clothes-boots?ir=collection%3Ahiking-gear-clothes-boots&r=category%3Amens-clothing&page=3,Arc'teryxBeta SL Jacket - Men's,https://www.rei.com/product/235112/arcteryx-beta-sl-jacket-mens,,,Arc'teryx   Beta SL Jacket - Men's,Arc'teryx,$500.00,"Made for alpine adventures, this Arc'teryx shell has GORE-TEX for waterproof, windproof protection. Pit zips provide venting. It also has a built-in RECCO® reflector. A trim fit allows easy layering.",#235112,"3L 40-denier x 70-denier GORE-TEX ePE with C-KNIT backer technology, plain weave recycled nylon, jet dyed, FC0 durable water repellent (DWR)"
1762309372-15,https://www.rei.com/s/hiking-gear-clothes-boots?ir=collection%3Ahiking-gear-clothes-boots&r=category%3Amens-clothing&page=3,SmartwoolHike Classic Edition Light Cushion Second Cut Crew Socks,https://www.rei.com/product/243850/smartwool-hike-classic-edition-light-cushion-second-cut-crew-socks,,,Smartwool   Hike Classic Edition Light Cushion Second Cut Crew Socks,Smartwool,$21.00,"An iconic pair, these Smartwool merino socks were reimagined to reduce waste and enhance durability and comfort. They're made to feel good on trail days.",#243850,33% merino wool/33% unknown fiber content mixed fibers/33% nylon/1% elastane
1762309377-16,https://www.rei.com/s/hiking-gear-clothes-boots?ir=collection%3Ahiking-gear-clothes-boots&r=category%3Amens-clothing&page=3,PatagoniaCapilene Cool Daily Graphic T-Shirt - Men's,https://www.rei.com/product/143348/patagonia-capilene-cool-daily-graphic-t-shirt-mens,,,Patagonia   Capilene Cool Daily Graphic T-Shirt  - Men's,Patagonia,$55.00,"Soft, quick-drying and stretchy, the men's Patagonia Capilene Cool Daily Graphic T-shirt offers versatile performance and comfort for whatever you've got planned.",#143348,Solids: 3.7 oz. recycled polyester jersey; heathers and cross-dyes: 4.1 oz. polyester (50% recycled) jersey
1762309379-17,https://www.rei.com/s/hiking-gear-clothes-boots?ir=collection%3Ahiking-gear-clothes-boots&r=category%3Amens-clothing&page=3,REI Co-op650 Down Hoodie - Men's,https://www.rei.com/product/221638/rei-co-op-650-down-hoodie-mens,,,REI Co-op   650 Down Hoodie - Men's,REI Co-op,$149.00,"Bundle up for a crisp air, chilly walks and crunchy leaves in the REI Co-op men's 650 Down hoodie. This everyday hoodie boasts recycled materials and a windproof shell to keep you warm in wild winds.",#221638,Recycled ripstop nylon (bluesign approved)
1762309382-18,https://www.rei.com/s/hiking-gear-clothes-boots?ir=collection%3Ahiking-gear-clothes-boots&r=category%3Amens-clothing&page=3,Arc'teryxAtom Insulated Vest - Men's,https://www.rei.com/product/242921/arcteryx-atom-insulated-vest-mens,,,Arc'teryx   Atom Insulated Vest - Men's,Arc'teryx,$200.00,Looking for warmth with a smaller footprint for chilly hikes or climbs? Pull on the men's Arc'teryx Atom insulated vest. It also works well layered under a shell for touring and wet winter objectives.,#242921,"Recycled 20-denier nylon plain weave weft stretch FC0 durable water repellent (DWR), 58 g/m2"
1762309385-19,https://www.rei.com/s/hiking-gear-clothes-boots?ir=collection%3Ahiking-gear-clothes-boots&r=category%3Amens-clothing&page=3,SmartwoolHike Classic Edition Full Cushion Over The Calf Socks,https://www.rei.com/product/254301/smartwool-hike-classic-edition-full-cushion-over-the-calf-socks,,,Smartwool   Hike Classic Edition Full Cushion Over The Calf Socks,Smartwool,$20.73,"Set your feet up for a great day on the trails with the Smartwool Hike Classic Edition Full Cushion Over The Calf Socks. With max padding and flat-knit toe seams, they're made for comfortable hiking.",#254301,71% merino wool/20% recycled nylon*/8% nylon/1% elastane (*specific percentage of recycled nylon will vary)
1762309389-20,https://www.rei.com/s/hiking-gear-clothes-boots?ir=collection%3Ahiking-gear-clothes-boots&r=category%3Amens-clothing&page=3,REI Co-opXeroCloud 3L Rain Jacket - Men's,https://www.rei.com/product/242158/rei-co-op-xerocloud-3l-rain-jacket-mens,,,REI Co-op   XeroCloud 3L Rain Jacket - Men's,REI Co-op,$189.00,"Meet the most technical REI Co-op backpacking shell yet: our XeroCloud 3L men's rain jacket. It provides 3-layer waterproof protection—and it has stretchy fabric, pit zips and a packable pocket.",#242158,72% recycled nylon/28% recycled polyester (bluesign approved) with jersey backer
1762309391-21,https://www.rei.com/s/hiking-gear-clothes-boots?ir=collection%3Ahiking-gear-clothes-boots&r=category%3Amens-clothing&page=3,Sunday AfternoonsUltra Adventure Hat,https://www.rei.com/product/894435/sunday-afternoons-ultra-adventure-hat,,,Sunday Afternoons   Ultra Adventure Hat,Sunday Afternoons,$50.00,"Hear that? It's the call of the wild. With the Sunday Afternoons Ultra Adventure Hat, you can bring your own shade with you wherever your adventures lead.",#894435,88% nylon/12% polyester
1762309395-22,https://www.rei.com/s/hiking-gear-clothes-boots?ir=collection%3Ahiking-gear-clothes-boots&r=category%3Amens-clothing&page=3,KUHLKlash Pants - Men's,https://www.rei.com/product/228278/kuhl-klash-pants-mens,,,KUHL   Klash Pants - Men's,KUHL,$139.00,"Designed for year-round performance, the men's KUHL Klash pants have added abrasion resistance and a durable water repellent (DWR) finish to hold up to a multitude of activities.",#228278,72% nylon/20% polyester/8% spandex
1762309398-23,https://www.rei.com/s/hiking-gear-clothes-boots?ir=collection%3Ahiking-gear-clothes-boots&r=category%3Amens-clothing&page=3,SmartwoolPerformance Hike Light Cushion Panorama Crew Socks - Men's,https://www.rei.com/product/230206/smartwool-performance-hike-light-cushion-panorama-crew-socks-mens,,,Smartwool   Performance Hike Light Cushion Panorama Crew Socks - Men's,Smartwool,$25.00,"With the comfort, durability and body-mapped breathability of the men's Smartwool Performance Hike Light Cushion Panorama crew socks, you'll feel light as air reaching those summit views.",#230206,54% merino wool/37% recycled nylon/6% nylon/3% elastane
